{
  "question_id": "Q_DEPLOY_GO",
  "text": "Should we deploy release candidate rc-4 to production this Friday?",
  "interrogative_type": "polar",
  "presuppositions": [
    {
      "id": "P_RC4_EXISTS",
      "text": "Release candidate rc-4 has been built and is available.",
      "validity": "verified"
    },
    {
      "id": "P_FRIDAY_WINDOW",
      "text": "A Friday deployment window is an option under the current change policy.",
      "validity": "verified"
    }
  ],
  "answer_schema": {
    "admissible": ["yes", "no", "indeterminate"],
    "warrant_required": true
  },
  "resolution_criteria": "Answer is complete and closed when a single value from {yes,no,indeterminate} is chosen AND a warrant cites the rc-4 test pass rate, open Sev-1 count, and rollback readiness against the documented go/no-go thresholds.",
  "decision_relevance": "Directly determines whether the team executes the Friday production deploy or holds; it is the go/no-go decision gate for this release.",
  "sub_questions": [
    {
      "id": "Q_TESTS_GREEN",
      "text": "Does rc-4 pass the full regression and smoke suite above the release threshold?",
      "type": "polar",
      "depends_on": []
    },
    {
      "id": "Q_OPEN_SEV1",
      "text": "How many open Sev-1 defects are attributable to rc-4?",
      "type": "quantitative",
      "depends_on": []
    },
    {
      "id": "Q_ROLLBACK_READY",
      "text": "Is a verified rollback path available within the deployment window?",
      "type": "polar",
      "depends_on": ["Q_TESTS_GREEN"]
    }
  ]
}
